{
  "id": "bergerie-du-capucin-dame-jeanne-rose-2025",
  "domaine_id": "bergerie-du-capucin",
  "appellation_id": "aoc-pic-saint-loup",
  "nom_cuvee": "Dame Jeanne",
  "couleur": "rose",
  "millesime": 2025,
  "assemblage": [
    {
      "cepage": "syrah",
      "pct": null
    },
    {
      "cepage": "grenache",
      "pct": null
    },
    {
      "cepage": "mourvedre",
      "pct": null
    }
  ],
  "degre": null,
  "elevage": "Pressurage direct, vinification traditionnelle avec maitrise permanente de la temperature. Le mourvedre est vinifie a part.",
  "prix_ttc": 13.0,
  "prix_date_releve": "2026-09-16",
  "bio": true,
  "certification": null,
  "note_degustation": "Equilibre de fruits rouges frais et epices, aux aromes suaves et poivres. Issue des trois cepages du Pic Saint-Loup, syrah, grenache et mourvedre. Sols argilo-calcaires sur sous-sols marneux, vignes de 20 ans. A servir entre 10 et 11 C, a deguster dans les deux ans.",
  "note_degustation_source": {
    "id": "page-bergerie-du-capucin-dame-jeanne-rose-2025",
    "type": "page_domaine",
    "label": "Fiche cuvee publiee par le domaine",
    "url": "https://bergerieducapucin.fr/fr/dame-jeanne/108-aop-dame-jeanne-rose-2024-75-cl.html",
    "autorite": "Bergerie du Capucin",
    "date_releve": "2026-09-16"
  },
  "accords_producteur": [
    "grillades",
    "salades composees",
    "fromages",
    "poissons a la plancha",
    "plats epices"
  ],
  "fiche_url": "https://bergerieducapucin.fr/fr/dame-jeanne/108-aop-dame-jeanne-rose-2024-75-cl.html"
}
