{
  "id": "bergerie-du-capucin-dame-jeanne-rouge-2023",
  "domaine_id": "bergerie-du-capucin",
  "appellation_id": "aoc-pic-saint-loup",
  "nom_cuvee": "Dame Jeanne",
  "couleur": "rouge",
  "millesime": 2023,
  "assemblage": [
    {
      "cepage": "syrah",
      "pct": null
    },
    {
      "cepage": "grenache",
      "pct": null
    },
    {
      "cepage": "mourvedre",
      "pct": null
    }
  ],
  "degre": 14.0,
  "elevage": "Vinification traditionnelle, maitrise des temperatures et longue maceration. Elevage en cuve.",
  "prix_ttc": 19.0,
  "prix_date_releve": "2026-09-16",
  "bio": true,
  "certification": null,
  "note_degustation": "Rencontre avec les fruits des bois et les epices. Issue de l'alliance des trois cepages du Pic Saint-Loup, syrah, grenache et mourvedre. Sols argilo-calcaires sur sous-sols marneux, vignes de 20 ans. Elevage en cuve. A servir entre 15 et 16 C, a conserver 3 a 5 ans.",
  "note_degustation_source": {
    "id": "page-bergerie-du-capucin-dame-jeanne-rouge-2023",
    "type": "page_domaine",
    "label": "Fiche cuvee publiee par le domaine",
    "url": "https://bergerieducapucin.fr/fr/dame-jeanne/111-aop-pic-saint-loup-dame-jeanne-rouge.html",
    "autorite": "Bergerie du Capucin",
    "date_releve": "2026-09-16"
  },
  "accords_producteur": [
    "aperitifs",
    "plats releves ou epices",
    "volailles",
    "viandes blanches et rouges",
    "grillades",
    "desserts chocolates"
  ],
  "fiche_url": "https://bergerieducapucin.fr/fr/dame-jeanne/111-aop-pic-saint-loup-dame-jeanne-rouge.html"
}
