{
  "id": "mas-bruguiere-la-grenadiere-2024",
  "domaine_id": "mas-bruguiere",
  "appellation_id": "aoc-pic-saint-loup",
  "nom_cuvee": "La Grenadiere",
  "couleur": "rouge",
  "millesime": 2024,
  "assemblage": [
    {
      "cepage": "syrah",
      "pct": 90
    },
    {
      "cepage": "grenache",
      "pct": 10
    }
  ],
  "degre": null,
  "elevage": "Extractions douces et elevage en grands contenants.",
  "prix_ttc": 30.0,
  "prix_date_releve": "2026-09-16",
  "bio": true,
  "certification": null,
  "note_degustation": "Robe grenat intense aux reflets pourpres. Nez equilibre melant fruits rouges et fruits noirs, avec de la profondeur. Cuvee issue des plus vieilles vignes du domaine, a servir apres un passage en carafe. Potentiel de garde de 15 a 25 ans.",
  "note_degustation_source": {
    "id": "page-mas-bruguiere-la-grenadiere-2024",
    "type": "page_domaine",
    "label": "Fiche cuvee publiee par le domaine",
    "url": "https://mas-bruguiere.com/produit/vin-la-grenadiere-aop-pic-saint-loup-rouge/",
    "autorite": "Mas Bruguiere",
    "date_releve": "2026-09-16"
  },
  "accords_producteur": [
    "gibier",
    "viandes longuement mijotees",
    "agneau basse temperature"
  ],
  "fiche_url": "https://mas-bruguiere.com/produit/vin-la-grenadiere-aop-pic-saint-loup-rouge/"
}
