{
  "id": "mas-foulaquier-les-calades-2024",
  "domaine_id": "mas-foulaquier",
  "appellation_id": "aoc-pic-saint-loup",
  "nom_cuvee": "Les Calades",
  "couleur": "rouge",
  "millesime": 2024,
  "assemblage": [
    {
      "cepage": "syrah",
      "pct": 80
    },
    {
      "cepage": "grenache",
      "pct": 20
    }
  ],
  "degre": null,
  "elevage": "Macerations douces et longues en infusion, sans intrants oenologiques.",
  "prix_ttc": 27.0,
  "prix_date_releve": "2026-09-16",
  "bio": null,
  "certification": null,
  "note_degustation": "Couleur dense et violine. Nez tres fruite (fruits noirs), camphre (eucalyptus) et epice (laurier), alliant gourmandise, souplesse et epice. Majorite de syrah. Terroir de Foulaquier, coteau d'eboulis calcaires sur argiles rouges au nord du Pic Saint-Loup, commune de Claret. Domaine conduit en biodynamie, vendange manuelle en caissettes de 20 kg.",
  "note_degustation_source": {
    "id": "page-mas-foulaquier-les-calades-2024",
    "type": "page_domaine",
    "label": "Fiche cuvee publiee par le domaine",
    "url": "https://boutique.masfoulaquier.fr/products/calades-mas-foulaquier",
    "autorite": "Mas Foulaquier",
    "date_releve": "2026-09-16"
  },
  "accords_producteur": [],
  "fiche_url": "https://boutique.masfoulaquier.fr/products/calades-mas-foulaquier"
}
