{
  "id": "mas-bruguiere-l-arbouse-2024",
  "domaine_id": "mas-bruguiere",
  "appellation_id": "aoc-pic-saint-loup",
  "nom_cuvee": "L'Arbouse",
  "couleur": "rouge",
  "millesime": 2024,
  "assemblage": [
    {
      "cepage": "syrah",
      "pct": 50
    },
    {
      "cepage": "grenache",
      "pct": 25
    },
    {
      "cepage": "mourvedre",
      "pct": 25
    }
  ],
  "degre": null,
  "elevage": "Extractions douces et elevage en grands contenants.",
  "prix_ttc": 20.0,
  "prix_date_releve": "2026-09-16",
  "bio": true,
  "certification": null,
  "note_degustation": "Robe grenat d'intensite moyenne, ponctuee de reflets violines dans sa jeunesse. Nez expressif marque par le croquant du fruit rouge frais. Bouche equilibree et gourmande, ou la rondeur s'associe a une belle fraicheur aromatique. Potentiel de garde de 5 a 15 ans.",
  "note_degustation_source": {
    "id": "page-mas-bruguiere-l-arbouse-2024",
    "type": "page_domaine",
    "label": "Fiche cuvee publiee par le domaine",
    "url": "https://mas-bruguiere.com/produit/l-arbouse-aop-pic-saint-loup-rouge/",
    "autorite": "Mas Bruguiere",
    "date_releve": "2026-09-16"
  },
  "accords_producteur": [
    "viandes mijotees",
    "tajine d'agneau",
    "magret de canard",
    "cuisine mediterraneenne",
    "pelardon"
  ],
  "fiche_url": "https://mas-bruguiere.com/produit/l-arbouse-aop-pic-saint-loup-rouge/"
}
