{
  "id": "morties-que-sera-sera-2024",
  "domaine_id": "domaine-de-morties",
  "appellation_id": "aoc-pic-saint-loup",
  "nom_cuvee": "Que Sera Sera",
  "couleur": "rouge",
  "millesime": 2024,
  "assemblage": [
    {
      "cepage": "syrah",
      "pct": 95
    },
    {
      "cepage": "grenache",
      "pct": 5
    }
  ],
  "degre": null,
  "elevage": "Vendanges manuelles, egrappage et pigeages, 20 a 25 jours de maceration. Elevage en pieces bourguignonnes de 400 litres pendant douze mois.",
  "prix_ttc": 45.5,
  "prix_date_releve": "2026-09-16",
  "bio": null,
  "certification": null,
  "note_degustation": "Notes marquees de fumee alliees a des parfums de garrigue ensoleillee et de baies sauvages confiturees. La bouche est longue, les tanins fins et delicats laissent presager une tres bonne garde.",
  "note_degustation_source": {
    "id": "page-morties-que-sera-sera-2024",
    "type": "page_domaine",
    "label": "Fiche cuvee publiee par le domaine",
    "url": "https://morties.com/products/que-sera-sera-vin-pic-saint-loup-morties-vente",
    "autorite": "Domaine de Morties",
    "date_releve": "2026-09-16"
  },
  "accords_producteur": [],
  "fiche_url": "https://morties.com/products/que-sera-sera-vin-pic-saint-loup-morties-vente"
}
