{
  "id": "domaine-b-lignes-les-terrasses-du-pic-2022",
  "domaine_id": "domaine-b-lignes",
  "appellation_id": "aoc-pic-saint-loup",
  "nom_cuvee": "Les Terrasses du Pic",
  "couleur": "rouge",
  "millesime": 2022,
  "assemblage": [
    {
      "cepage": "syrah",
      "pct": 55.0
    },
    {
      "cepage": "grenache",
      "pct": 30.0
    },
    {
      "cepage": "mourvedre",
      "pct": 15.0
    }
  ],
  "degre": 13.5,
  "elevage": "12 mois en cuve inox puis 6 mois en bouteille",
  "prix_ttc": 15.8,
  "prix_date_releve": "2026-09-15",
  "bio": null,
  "certification": null,
  "note_degustation": "Nez expressif de cerise noire et de garrigue. Attaque souple, texture soyeuse, tanins fondus. La finale reste fraiche et mentholee.",
  "note_degustation_source": {
    "id": "fiche-domaine-b-lignes",
    "type": "fiche_technique",
    "label": "Fiche technique domaine-b-lignes",
    "url": "https://example.invalid/fiches/domaine-b-lignes.pdf",
    "date_releve": "2026-09-15"
  },
  "accords_producteur": [],
  "fiche_url": "https://example.invalid/fiches/domaine-b-lignes.pdf"
}
