{
  "id": "mas-foulaquier-picaleon-2024",
  "domaine_id": "mas-foulaquier",
  "appellation_id": "aoc-pic-saint-loup",
  "nom_cuvee": "Picaleon",
  "couleur": "rouge",
  "millesime": 2024,
  "assemblage": [
    {
      "cepage": "syrah",
      "pct": 50
    },
    {
      "cepage": "grenache",
      "pct": 50
    }
  ],
  "degre": null,
  "elevage": "Macerations douces et longues en infusion, sans intrants oenologiques. Cuvee labellisee Vin Methode Nature sans sulfites ajoutes.",
  "prix_ttc": 16.0,
  "prix_date_releve": "2026-09-16",
  "bio": null,
  "certification": null,
  "note_degustation": "Pic Saint-Loup plus leger que L'Orphee, alliant fruit et gourmandise grace a l'equilibre entre syrah et grenache. Terroir de Foulaquier, coteau d'eboulis calcaires sur argiles rouges au nord du Pic Saint-Loup, commune de Claret. Domaine conduit en biodynamie, vendange manuelle en caissettes de 20 kg.",
  "note_degustation_source": {
    "id": "page-mas-foulaquier-picaleon-2024",
    "type": "page_domaine",
    "label": "Fiche cuvee publiee par le domaine",
    "url": "https://boutique.masfoulaquier.fr/products/picaleon-2024-pic-saint-loup-fruite-et-epice-17",
    "autorite": "Mas Foulaquier",
    "date_releve": "2026-09-16"
  },
  "accords_producteur": [],
  "fiche_url": "https://boutique.masfoulaquier.fr/products/picaleon-2024-pic-saint-loup-fruite-et-epice-17"
}
